{"asset_manifest":"asset_manifest.json","elements":[{"editable":true,"fill":{"color":"#EAF3FF"},"h":2.24,"id":"bg-top-right-orb","line":{"color":"#EAF3FF","width_pt":0.5},"shape":"ellipse","type":"shape","w":2.553,"x":10.78,"y":0,"z_index":0},{"editable":true,"fill":{"color":"#EDF4FF"},"h":1.75,"id":"bg-bottom-left-orb","line":{"color":"#EDF4FF","width_pt":0.5},"shape":"ellipse","type":"shape","w":3.36,"x":0,"y":5.75,"z_index":0},{"editability_required":true,"editable":true,"h":0.62,"id":"title","style_ref":"title","text":"保持简单，才能持续复用","type":"text","w":6.23,"x":3.55,"y":1.19,"z_index":10},{"editability_required":true,"editable":true,"h":0.32,"id":"subtitle","style_ref":"subtitle","text":"Zero-Asset Baseline","type":"text","w":3.0,"x":5.17,"y":2.13,"z_index":10},{"editable":true,"fill":{"color":"#EAF4FF"},"h":1.59,"id":"card-left","line":{"color":"#8FC2EF","width_pt":1.5},"radius_hint":0.28,"shape":"roundRect","type":"shape","w":3.78,"x":2.13,"y":3.27,"z_index":5},{"editable":true,"fill":{"color":"#ECF8F1"},"h":1.59,"id":"card-right","line":{"color":"#83CDA8","width_pt":1.5},"radius_hint":0.28,"shape":"roundRect","type":"shape","w":3.78,"x":7.44,"y":3.27,"z_index":5},{"editable":true,"from_id":"card-left","geometry":"straight","h":0.01,"id":"flow-arrow","line":{"begin_arrow":"none","color":"#5B8DD4","end_arrow":"triangle","width_pt":4},"to_id":"card-right","type":"line","w":1.53,"x":5.91,"y":4.07,"z_index":6},{"editability_required":true,"editable":true,"h":0.38,"id":"card-left-title","style_ref":"card_title","text":"结构清晰","type":"text","w":2.54,"x":2.75,"y":3.69,"z_index":10},{"editability_required":true,"editable":true,"h":0.28,"id":"card-left-body","style_ref":"card_body","text":"只使用原生文字与形状","type":"text","w":2.68,"x":2.68,"y":4.25,"z_index":10},{"editability_required":true,"editable":true,"h":0.38,"id":"card-right-title","style_ref":"card_title","text":"路径最短","type":"text","w":2.54,"x":8.06,"y":3.69,"z_index":10},{"editability_required":true,"editable":true,"h":0.28,"id":"card-right-body","style_ref":"card_body","text":"不产生裁切或图片资产","type":"text","w":2.8,"x":7.93,"y":4.25,"z_index":10},{"editability_required":true,"editable":true,"h":0.34,"id":"footer","style_ref":"footer","text":"输入明确 → 构建直接 → 证据完整","type":"text","w":4.91,"x":4.21,"y":5.8,"z_index":10}],"metadata":{"iteration":1,"topic":"Zero-Asset Baseline","typography_interaction":"match-source"},"request":"request.json","schema_version":"1.3","slide":{"background":"#F7F8FA","height_in":7.5,"width_in":13.333},"source":{"height_px":941,"image":"source.png","width_px":1672},"styles":{"card_body":{"align":"center","color":"#4A6380","fit":"shrink","font_face":"Microsoft YaHei","font_size_pt":14,"language":"zh-CN","margin_in":0,"valign":"middle"},"card_title":{"align":"center","bold":true,"color":"#143A76","fit":"shrink","font_face":"Microsoft YaHei","font_size_pt":21,"language":"zh-CN","margin_in":0,"valign":"middle"},"footer":{"align":"center","bold":true,"color":"#2263AA","fit":"shrink","font_face":"Microsoft YaHei","font_size_pt":17,"language":"zh-CN","margin_in":0,"valign":"middle"},"subtitle":{"align":"center","color":"#496D99","fit":"shrink","font_face":"Microsoft YaHei","font_size_pt":18,"language":"en-US","margin_in":0,"valign":"middle"},"title":{"align":"center","bold":true,"color":"#173A78","fit":"shrink","font_face":"Microsoft YaHei","font_size_pt":34,"language":"zh-CN","margin_in":0,"valign":"middle"}}}
