{"asset_manifest":"asset_manifest.json","elements":[{"editable":true,"fill":{"color":"#E8F2FF"},"h":2.24,"id":"bg-circle-top-right","line":{"color":"#E8F2FF","width_pt":0.5},"shape":"ellipse","type":"shape","w":2.553,"x":10.78,"y":0,"z_index":1},{"editable":true,"fill":{"color":"#EDF4FF"},"h":1.75,"id":"bg-circle-bottom-left","line":{"color":"#EDF4FF","width_pt":0.5},"shape":"ellipse","type":"shape","w":3.36,"x":0,"y":5.75,"z_index":1},{"editability_required":true,"editable":true,"h":0.52,"id":"title","style_ref":"title","text":"城市微更新观察","type":"text","w":4.35,"x":0.65,"y":0.56,"z_index":10},{"editability_required":true,"editable":true,"h":0.27,"id":"subtitle","style_ref":"subtitle","text":"在有限空间里创造更友好的公共体验","type":"text","w":5.2,"x":0.67,"y":1.17,"z_index":10},{"alt_text":"带圆角白色边框的公园山景插画，含太阳、山丘、草地和长椅","asset_id":"landscape-panel","contains_text":false,"editable":false,"fit":"contain","h":4.505,"id":"landscape-panel-image","preserve_aspect_ratio":true,"rounding":false,"type":"image","w":6.94,"x":0.718,"y":1.953,"z_index":5},{"editable":true,"fill":{"color":"#FFFFFF"},"h":4.49,"id":"conclusion-card","line":{"color":"#A5D7E4","width_pt":1.5},"radius_hint":0.1,"shape":"roundRect","type":"shape","w":4.27,"x":8.3,"y":1.96,"z_index":3},{"editability_required":true,"editable":true,"h":0.38,"id":"conclusion-heading","style_ref":"panel_heading","text":"观察结论","type":"text","w":2.25,"x":8.68,"y":2.43,"z_index":10},{"editable":true,"fill":{"color":"#1591AF"},"h":0.17,"id":"bullet-dot-1","line":{"color":"#1591AF","width_pt":0.5},"shape":"ellipse","type":"shape","w":0.17,"x":8.69,"y":3.17,"z_index":10},{"editability_required":true,"editable":true,"h":0.3,"id":"bullet-text-1","style_ref":"body","text":"增加可停留的遮阴空间","type":"text","w":2.95,"x":9.02,"y":3.1,"z_index":10},{"editable":true,"fill":{"color":"#1591AF"},"h":0.17,"id":"bullet-dot-2","line":{"color":"#1591AF","width_pt":0.5},"shape":"ellipse","type":"shape","w":0.17,"x":8.69,"y":3.81,"z_index":10},{"editability_required":true,"editable":true,"h":0.3,"id":"bullet-text-2","style_ref":"body","text":"保留清晰的步行通道","type":"text","w":2.95,"x":9.02,"y":3.74,"z_index":10},{"editable":true,"fill":{"color":"#1591AF"},"h":0.17,"id":"bullet-dot-3","line":{"color":"#1591AF","width_pt":0.5},"shape":"ellipse","type":"shape","w":0.17,"x":8.69,"y":4.45,"z_index":10},{"editability_required":true,"editable":true,"h":0.3,"id":"bullet-text-3","style_ref":"body","text":"用色彩建立区域识别","type":"text","w":2.95,"x":9.02,"y":4.38,"z_index":10},{"editable":true,"fill":{"color":"#1591AF"},"h":0.17,"id":"bullet-dot-4","line":{"color":"#1591AF","width_pt":0.5},"shape":"ellipse","type":"shape","w":0.17,"x":8.69,"y":5.09,"z_index":10},{"editability_required":true,"editable":true,"h":0.3,"id":"bullet-text-4","style_ref":"body","text":"让设施支持多种活动","type":"text","w":2.95,"x":9.02,"y":5.02,"z_index":10},{"editable":true,"fill":{"color":"#E2F6F7"},"h":0.48,"id":"principles-badge","line":{"color":"#5FC2D2","width_pt":1.0},"radius_hint":0.24,"shape":"roundRect","type":"shape","w":3.65,"x":8.6,"y":5.67,"z_index":8},{"editability_required":true,"editable":true,"h":0.28,"id":"principles-text","style_ref":"badge","text":"小尺度 · 高感知 · 可持续","type":"text","w":3.3,"x":8.78,"y":5.72,"z_index":10}],"metadata":{"iteration":2,"topic":"城市微更新观察","typography_interaction":"match-source"},"request":"request.json","schema_version":"1.3","slide":{"background":"#F4F6F8","height_in":7.5,"width_in":13.333},"source":{"height_px":941,"image":"source.png","width_px":1672},"styles":{"badge":{"align":"center","bold":false,"color":"#006A7D","fit":"shrink","font_face":"Microsoft YaHei","font_size_pt":14,"language":"zh-CN","margin_in":0,"valign":"middle"},"body":{"align":"left","color":"#344F62","fit":"shrink","font_face":"Microsoft YaHei","font_size_pt":16,"language":"zh-CN","margin_in":0,"valign":"middle"},"panel_heading":{"align":"left","bold":false,"color":"#006A83","fit":"shrink","font_face":"Microsoft YaHei","font_size_pt":22,"language":"zh-CN","margin_in":0,"valign":"middle"},"subtitle":{"align":"left","color":"#35617A","fit":"shrink","font_face":"Microsoft YaHei","font_size_pt":18,"language":"zh-CN","margin_in":0,"valign":"middle"},"title":{"align":"left","bold":true,"color":"#12346E","fit":"shrink","font_face":"Microsoft YaHei","font_size_pt":34,"language":"zh-CN","margin_in":0,"valign":"middle"}}}
