{"asset_manifest":"asset_manifest.json","elements":[{"editable":true,"fill":{"color":"#E6F0FC","transparency":8},"h":2.24,"id":"decor_top_right","line":{"color":"#E6F0FC","transparency":100,"width_pt":0.5},"shape":"ellipse","type":"shape","w":2.563,"x":10.77,"y":0,"z_index":1},{"editable":true,"fill":{"color":"#EEF4FC","transparency":4},"h":1.75,"id":"decor_bottom_left","line":{"color":"#EEF4FC","transparency":100,"width_pt":0.5},"shape":"ellipse","type":"shape","w":3.35,"x":0,"y":5.75,"z_index":1},{"editability_required":true,"editable":true,"h":0.52,"id":"title","style_ref":"title","text":"项目启动简报","type":"text","w":3.25,"x":0.67,"y":0.65,"z_index":10},{"editability_required":true,"editable":true,"h":0.3,"id":"subtitle","style_ref":"subtitle","text":"从目标到行动的三步协作框架","type":"text","w":3.05,"x":0.69,"y":1.21,"z_index":10},{"editable":true,"fill":{"color":"#E6F0FC"},"h":2.9,"id":"card_01","line":{"color":"#9ABCF0","width_pt":1.3},"radius_hint":0.14,"shape":"roundRect","type":"shape","w":3.54,"x":0.73,"y":2.17,"z_index":5},{"editable":true,"fill":{"color":"#EAF7F3"},"h":2.9,"id":"card_02","line":{"color":"#9ABCF0","width_pt":1.3},"radius_hint":0.14,"shape":"roundRect","type":"shape","w":3.54,"x":4.88,"y":2.17,"z_index":5},{"editable":true,"fill":{"color":"#FFF3DE"},"h":2.9,"id":"card_03","line":{"color":"#9ABCF0","width_pt":1.3},"radius_hint":0.14,"shape":"roundRect","type":"shape","w":3.54,"x":9.03,"y":2.17,"z_index":5},{"editable":true,"fill":{"color":"#2869DB"},"h":0.61,"id":"badge_01","line":{"color":"#2869DB","width_pt":0.5},"shape":"ellipse","type":"shape","w":0.61,"x":1.01,"y":2.49,"z_index":8},{"editable":true,"fill":{"color":"#2869DB"},"h":0.61,"id":"badge_02","line":{"color":"#2869DB","width_pt":0.5},"shape":"ellipse","type":"shape","w":0.61,"x":5.16,"y":2.49,"z_index":8},{"editable":true,"fill":{"color":"#2869DB"},"h":0.61,"id":"badge_03","line":{"color":"#2869DB","width_pt":0.5},"shape":"ellipse","type":"shape","w":0.61,"x":9.31,"y":2.49,"z_index":8},{"editability_required":true,"editable":true,"h":0.61,"id":"badge_text_01","style_ref":"badge","text":"1","type":"text","w":0.61,"x":1.01,"y":2.49,"z_index":9},{"editability_required":true,"editable":true,"h":0.61,"id":"badge_text_02","style_ref":"badge","text":"2","type":"text","w":0.61,"x":5.16,"y":2.49,"z_index":9},{"editability_required":true,"editable":true,"h":0.61,"id":"badge_text_03","style_ref":"badge","text":"3","type":"text","w":0.61,"x":9.31,"y":2.49,"z_index":9},{"editability_required":true,"editable":true,"h":0.36,"id":"card_title_01","style_ref":"card_title","text":"01  明确目标","type":"text","w":2.55,"x":1.05,"y":3.39,"z_index":9},{"editability_required":true,"editable":true,"h":0.36,"id":"card_title_02","style_ref":"card_title","text":"02  分配行动","type":"text","w":2.55,"x":5.2,"y":3.39,"z_index":9},{"editability_required":true,"editable":true,"h":0.36,"id":"card_title_03","style_ref":"card_title","text":"03  验证结果","type":"text","w":2.55,"x":9.35,"y":3.39,"z_index":9},{"editability_required":true,"editable":true,"h":0.28,"id":"card_body_01","style_ref":"card_body","text":"统一范围与成功标准","type":"text","w":2.55,"x":1.05,"y":3.96,"z_index":9},{"editability_required":true,"editable":true,"h":0.28,"id":"card_body_02","style_ref":"card_body","text":"确认负责人和完成时间","type":"text","w":2.55,"x":5.2,"y":3.96,"z_index":9},{"editability_required":true,"editable":true,"h":0.28,"id":"card_body_03","style_ref":"card_body","text":"用证据复盘并持续改进","type":"text","w":2.55,"x":9.35,"y":3.96,"z_index":9},{"editable":true,"geometry":"straight","h":0,"id":"divider_01","line":{"begin_arrow":"none","color":"#93B4E4","end_arrow":"none","width_pt":1.2},"type":"line","w":2.59,"x":1.05,"y":4.47,"z_index":8},{"editable":true,"geometry":"straight","h":0,"id":"divider_02","line":{"begin_arrow":"none","color":"#93B4E4","end_arrow":"none","width_pt":1.2},"type":"line","w":2.59,"x":5.2,"y":4.47,"z_index":8},{"editable":true,"geometry":"straight","h":0,"id":"divider_03","line":{"begin_arrow":"none","color":"#93B4E4","end_arrow":"none","width_pt":1.2},"type":"line","w":2.59,"x":9.35,"y":4.47,"z_index":8},{"editable":true,"fill":{"color":"#2869D7"},"h":0.76,"id":"footer_bar","line":{"color":"#2869D7","width_pt":0.5},"radius_hint":0.76,"shape":"roundRect","type":"shape","w":8.13,"x":2.61,"y":5.94,"z_index":6},{"editability_required":true,"editable":true,"h":0.43,"id":"footer_text","style_ref":"footer","text":"目标清晰 • 行动可追踪 • 结果可验证","type":"text","w":7.63,"x":2.86,"y":6.09,"z_index":9}],"metadata":{"iteration":3,"topic":"项目启动简报","typography_interaction":"match-source"},"request":"request.json","schema_version":"1.3","slide":{"background":"#F4F7FA","height_in":7.5,"width_in":13.333},"source":{"height_px":941,"image":"source.png","width_px":1672},"styles":{"badge":{"align":"center","bold":true,"color":"#FFFFFF","fit":"shrink","font_face":"Microsoft YaHei","font_size_pt":21,"language":"zh-CN","margin_in":0,"valign":"middle"},"card_body":{"align":"left","bold":false,"color":"#385781","fit":"shrink","font_face":"Microsoft YaHei","font_size_pt":14,"language":"zh-CN","margin_in":0,"valign":"middle"},"card_title":{"align":"left","bold":true,"color":"#14366E","fit":"shrink","font_face":"Microsoft YaHei","font_size_pt":20,"language":"zh-CN","margin_in":0,"valign":"middle"},"footer":{"align":"center","bold":true,"color":"#FFFFFF","fit":"shrink","font_face":"Microsoft YaHei","font_size_pt":18,"language":"zh-CN","margin_in":0,"valign":"middle"},"subtitle":{"align":"left","bold":false,"color":"#426393","fit":"shrink","font_face":"Microsoft YaHei","font_size_pt":18,"language":"zh-CN","margin_in":0,"valign":"middle"},"title":{"align":"left","bold":true,"color":"#163B78","fit":"shrink","font_face":"Microsoft YaHei","font_size_pt":34,"language":"zh-CN","margin_in":0,"valign":"middle"}}}
