{"asset_manifest":"asset_manifest.json","elements":[{"editable":true,"fill":{"color":"#E8F2FF"},"h":2.24,"id":"bg-circle-top-right","line":{"color":"#E8F2FF","width_pt":0.5},"shape":"ellipse","type":"shape","w":2.553,"x":10.78,"y":0,"z_index":1},{"editable":true,"fill":{"color":"#EDF4FF"},"h":1.75,"id":"bg-circle-bottom-left","line":{"color":"#EDF4FF","width_pt":0.5},"shape":"ellipse","type":"shape","w":3.36,"x":0,"y":5.75,"z_index":1},{"editability_required":true,"editable":true,"h":0.53,"id":"title","style_ref":"title","text":"需求到交付的闭环流程","type":"text","w":5.7,"x":0.65,"y":0.55,"z_index":20},{"editability_required":true,"editable":true,"h":0.28,"id":"subtitle","style_ref":"subtitle","text":"分支评审、结果汇合与反馈回路必须保持连通","type":"text","w":5.8,"x":0.67,"y":1.15,"z_index":20},{"editable":true,"from_id":"node-input","geometry":"straight","h":0,"id":"flow-input-to-split","line":{"begin_arrow":"none","color":"#3E7DEC","end_arrow":"none","width_pt":4.0},"to_id":"node-design","type":"line","w":0.44,"x":2.67,"y":3.43,"z_index":5},{"editable":true,"from_id":"node-input","geometry":"straight","h":2.56,"id":"flow-split-trunk","line":{"begin_arrow":"none","color":"#3E7DEC","end_arrow":"none","width_pt":4.0},"to_id":"node-risk","type":"line","w":0,"x":3.11,"y":2.43,"z_index":5},{"editable":true,"from_id":"node-input","geometry":"straight","h":0,"id":"flow-split-to-design","line":{"begin_arrow":"none","color":"#3E7DEC","end_arrow":"triangle","width_pt":4.0},"to_id":"node-design","type":"line","w":0.41,"x":3.11,"y":2.43,"z_index":5},{"editable":true,"from_id":"node-input","geometry":"straight","h":0,"id":"flow-split-to-risk","line":{"begin_arrow":"none","color":"#3E7DEC","end_arrow":"triangle","width_pt":4.0},"to_id":"node-risk","type":"line","w":0.41,"x":3.11,"y":4.99,"z_index":5},{"editable":true,"from_id":"node-design","geometry":"straight","h":0,"id":"flow-design-to-merge","line":{"begin_arrow":"none","color":"#3E7DEC","end_arrow":"none","width_pt":4.0},"to_id":"node-execution","type":"line","w":0.49,"x":5.59,"y":2.43,"z_index":5},{"editable":true,"from_id":"node-risk","geometry":"straight","h":0,"id":"flow-risk-to-merge","line":{"begin_arrow":"none","color":"#3E7DEC","end_arrow":"none","width_pt":4.0},"to_id":"node-execution","type":"line","w":0.49,"x":5.59,"y":4.99,"z_index":5},{"editable":true,"from_id":"node-design","geometry":"straight","h":2.56,"id":"flow-merge-trunk","line":{"begin_arrow":"none","color":"#3E7DEC","end_arrow":"none","width_pt":4.0},"to_id":"node-execution","type":"line","w":0,"x":6.08,"y":2.43,"z_index":5},{"editable":true,"from_id":"node-design","geometry":"straight","h":0,"id":"flow-merge-to-execution","line":{"begin_arrow":"none","color":"#3E7DEC","end_arrow":"triangle","width_pt":4.0},"to_id":"node-execution","type":"line","w":0.46,"x":6.08,"y":3.43,"z_index":5},{"editable":true,"from_id":"node-execution","geometry":"straight","h":0,"id":"flow-execution-to-acceptance","line":{"begin_arrow":"none","color":"#3E7DEC","end_arrow":"triangle","width_pt":4.0},"to_id":"node-acceptance","type":"line","w":1.33,"x":8.61,"y":3.43,"z_index":5},{"editable":true,"from_id":"node-acceptance","geometry":"straight","h":2.27,"id":"feedback-down","line":{"begin_arrow":"none","color":"#E8733A","end_arrow":"none","width_pt":3.5},"to_id":"node-input","type":"line","w":0,"x":11.01,"y":3.99,"z_index":5},{"editable":true,"from_id":"node-acceptance","geometry":"straight","h":0,"id":"feedback-bottom","line":{"begin_arrow":"none","color":"#E8733A","end_arrow":"none","width_pt":3.5},"to_id":"node-input","type":"line","w":9.33,"x":1.68,"y":6.26,"z_index":5},{"editable":true,"from_id":"node-acceptance","geometry":"straight","h":2.27,"id":"feedback-up-to-input","line":{"begin_arrow":"triangle","color":"#E8733A","end_arrow":"none","width_pt":3.5},"to_id":"node-input","type":"line","w":0,"x":1.68,"y":3.99,"z_index":5},{"editable":true,"fill":{"color":"#EAF2FF"},"h":1.1,"id":"node-input","line":{"color":"#88AFE7","width_pt":2.0},"radius_hint":0.2,"shape":"roundRect","type":"shape","w":1.95,"x":0.72,"y":2.89,"z_index":10},{"editable":true,"fill":{"color":"#EAF8F5"},"h":1.1,"id":"node-design","line":{"color":"#88AFE7","width_pt":2.0},"radius_hint":0.2,"shape":"roundRect","type":"shape","w":2.07,"x":3.52,"y":1.89,"z_index":10},{"editable":true,"fill":{"color":"#FFF0D9"},"h":1.1,"id":"node-risk","line":{"color":"#88AFE7","width_pt":2.0},"radius_hint":0.2,"shape":"roundRect","type":"shape","w":2.07,"x":3.52,"y":4.44,"z_index":10},{"editable":true,"fill":{"color":"#F0F0FF"},"h":1.1,"id":"node-execution","line":{"color":"#88AFE7","width_pt":2.0},"radius_hint":0.2,"shape":"roundRect","type":"shape","w":2.07,"x":6.54,"y":2.89,"z_index":10},{"editable":true,"fill":{"color":"#E5F8F5"},"h":1.1,"id":"node-acceptance","line":{"color":"#88AFE7","width_pt":2.0},"radius_hint":0.2,"shape":"roundRect","type":"shape","w":2.14,"x":9.94,"y":2.89,"z_index":10},{"editability_required":true,"editable":true,"h":0.36,"id":"label-input","style_ref":"node","text":"需求输入","type":"text","w":1.57,"x":0.91,"y":3.23,"z_index":20},{"editability_required":true,"editable":true,"h":0.36,"id":"label-design","style_ref":"node","text":"方案设计","type":"text","w":1.67,"x":3.72,"y":2.23,"z_index":20},{"editability_required":true,"editable":true,"h":0.36,"id":"label-risk","style_ref":"node","text":"风险评审","type":"text","w":1.67,"x":3.72,"y":4.78,"z_index":20},{"editability_required":true,"editable":true,"h":0.36,"id":"label-execution","style_ref":"node","text":"统一执行","type":"text","w":1.67,"x":6.74,"y":3.23,"z_index":20},{"editability_required":true,"editable":true,"h":0.36,"id":"label-acceptance","style_ref":"node","text":"结果验收","type":"text","w":1.74,"x":10.14,"y":3.23,"z_index":20},{"editability_required":true,"editable":true,"h":0.26,"id":"label-parallel","style_ref":"annotation","text":"并行","type":"text","w":0.62,"x":4.18,"y":3.14,"z_index":20},{"editability_required":true,"editable":true,"h":0.26,"id":"label-merge","style_ref":"annotation","text":"汇合","type":"text","w":0.62,"x":5.72,"y":3.58,"z_index":20},{"editability_required":true,"editable":true,"h":0.32,"id":"label-feedback","style_ref":"feedback","text":"验收反馈回到需求输入","type":"text","w":2.25,"x":5.3,"y":6.52,"z_index":20}],"metadata":{"iteration":2,"topic":"需求到交付的闭环流程","topology":"需求输入 branches in parallel to 方案设计 and 风险评审; both merge into 统一执行, flow to 结果验收, then feedback returns to 需求输入","typography_interaction":"match-source"},"request":"request.json","schema_version":"1.3","slide":{"background":"#F6F7FA","height_in":7.5,"width_in":13.333},"source":{"height_px":941,"image":"source.png","width_px":1672},"styles":{"annotation":{"align":"center","color":"#405B98","fit":"shrink","font_face":"Microsoft YaHei","font_size_pt":12,"language":"zh-CN","margin_in":0,"valign":"middle"},"feedback":{"align":"center","bold":false,"color":"#C64D1D","fit":"shrink","font_face":"Microsoft YaHei","font_size_pt":14,"language":"zh-CN","margin_in":0,"valign":"middle"},"node":{"align":"center","bold":false,"color":"#12346E","fit":"shrink","font_face":"Microsoft YaHei","font_size_pt":17,"language":"zh-CN","margin_in":0,"valign":"middle"},"subtitle":{"align":"left","color":"#435D9B","fit":"shrink","font_face":"Microsoft YaHei","font_size_pt":15,"language":"zh-CN","margin_in":0,"valign":"middle"},"title":{"align":"left","bold":true,"color":"#12346E","fit":"shrink","font_face":"Microsoft YaHei","font_size_pt":32,"language":"zh-CN","margin_in":0,"valign":"middle"}}}
