{"asset_manifest":"asset_manifest.json","elements":[{"editable":true,"fill":{"color":"#E6F0FC","transparency":8},"h":2.24,"id":"decor_top_right","line":{"color":"#E6F0FC","transparency":100,"width_pt":0.5},"shape":"ellipse","type":"shape","w":2.563,"x":10.77,"y":0,"z_index":1},{"editable":true,"fill":{"color":"#EEF4FC","transparency":4},"h":1.75,"id":"decor_bottom_left","line":{"color":"#EEF4FC","transparency":100,"width_pt":0.5},"shape":"ellipse","type":"shape","w":3.35,"x":0,"y":5.75,"z_index":1},{"editability_required":true,"editable":true,"h":0.52,"id":"title","style_ref":"title","text":"团队能力地图","type":"text","w":3.05,"x":0.66,"y":0.55,"z_index":10},{"editability_required":true,"editable":true,"h":0.28,"id":"subtitle","style_ref":"subtitle","text":"六个能力模块共同支撑稳定交付","type":"text","w":3.65,"x":0.67,"y":1.2,"z_index":10},{"editable":true,"fill":{"color":"#FFFFFF"},"h":1.79,"id":"card_goal","line":{"color":"#A2C4F6","width_pt":1.25},"radius_hint":0.2,"shape":"roundRect","type":"shape","w":3.75,"x":0.61,"y":1.84,"z_index":5},{"editable":true,"fill":{"color":"#FFFFFF"},"h":1.79,"id":"card_data","line":{"color":"#A2C4F6","width_pt":1.25},"radius_hint":0.2,"shape":"roundRect","type":"shape","w":3.75,"x":4.79,"y":1.84,"z_index":5},{"editable":true,"fill":{"color":"#FFFFFF"},"h":1.79,"id":"card_quality","line":{"color":"#A2C4F6","width_pt":1.25},"radius_hint":0.2,"shape":"roundRect","type":"shape","w":3.75,"x":8.98,"y":1.84,"z_index":5},{"editable":true,"fill":{"color":"#FFFFFF"},"h":1.79,"id":"card_innovation","line":{"color":"#A2C4F6","width_pt":1.25},"radius_hint":0.2,"shape":"roundRect","type":"shape","w":3.75,"x":0.61,"y":4.11,"z_index":5},{"editable":true,"fill":{"color":"#FFFFFF"},"h":1.79,"id":"card_collaboration","line":{"color":"#A2C4F6","width_pt":1.25},"radius_hint":0.2,"shape":"roundRect","type":"shape","w":3.75,"x":4.79,"y":4.11,"z_index":5},{"editable":true,"fill":{"color":"#FFFFFF"},"h":1.79,"id":"card_improvement","line":{"color":"#A2C4F6","width_pt":1.25},"radius_hint":0.2,"shape":"roundRect","type":"shape","w":3.75,"x":8.98,"y":4.11,"z_index":5},{"alt_text":"目标管理靶心图标","asset_id":"asset_icon_goal","contains_text":false,"editable":false,"fit":"contain","h":0.88,"id":"icon_goal","preserve_aspect_ratio":true,"rounding":false,"type":"image","w":0.89,"x":0.84,"y":2.14,"z_index":8},{"alt_text":"数据洞察柱状图图标","asset_id":"asset_icon_data","contains_text":false,"editable":false,"fit":"contain","h":0.88,"id":"icon_data","preserve_aspect_ratio":true,"rounding":false,"type":"image","w":0.89,"x":5.03,"y":2.14,"z_index":8},{"alt_text":"质量保障勾选框图标","asset_id":"asset_icon_quality","contains_text":false,"editable":false,"fit":"contain","h":0.88,"id":"icon_quality","preserve_aspect_ratio":true,"rounding":false,"type":"image","w":0.89,"x":9.22,"y":2.14,"z_index":8},{"alt_text":"创新实验闪光图标","asset_id":"asset_icon_innovation","contains_text":false,"editable":false,"fit":"contain","h":0.88,"id":"icon_innovation","preserve_aspect_ratio":true,"rounding":false,"type":"image","w":0.89,"x":0.84,"y":4.41,"z_index":8},{"alt_text":"协同共创团队图标","asset_id":"asset_icon_collaboration","contains_text":false,"editable":false,"fit":"contain","h":0.88,"id":"icon_collaboration","preserve_aspect_ratio":true,"rounding":false,"type":"image","w":0.89,"x":5.03,"y":4.41,"z_index":8},{"alt_text":"持续改进循环图标","asset_id":"asset_icon_improvement","contains_text":false,"editable":false,"fit":"contain","h":0.88,"id":"icon_improvement","preserve_aspect_ratio":true,"rounding":false,"type":"image","w":0.89,"x":9.22,"y":4.41,"z_index":8},{"editability_required":true,"editable":true,"h":0.32,"id":"title_goal","style_ref":"card_title","text":"目标管理","type":"text","w":1.85,"x":1.92,"y":2.33,"z_index":9},{"editability_required":true,"editable":true,"h":0.32,"id":"title_data","style_ref":"card_title","text":"数据洞察","type":"text","w":1.85,"x":6.1,"y":2.33,"z_index":9},{"editability_required":true,"editable":true,"h":0.32,"id":"title_quality","style_ref":"card_title","text":"质量保障","type":"text","w":1.85,"x":10.29,"y":2.33,"z_index":9},{"editability_required":true,"editable":true,"h":0.32,"id":"title_innovation","style_ref":"card_title","text":"创新实验","type":"text","w":1.85,"x":1.92,"y":4.6,"z_index":9},{"editability_required":true,"editable":true,"h":0.32,"id":"title_collaboration","style_ref":"card_title","text":"协同共创","type":"text","w":1.85,"x":6.1,"y":4.6,"z_index":9},{"editability_required":true,"editable":true,"h":0.32,"id":"title_improvement","style_ref":"card_title","text":"持续改进","type":"text","w":1.85,"x":10.29,"y":4.6,"z_index":9},{"editability_required":true,"editable":true,"h":0.28,"id":"body_goal","style_ref":"card_body","text":"把方向转化为可衡量结果","type":"text","w":2.0,"x":1.92,"y":2.79,"z_index":9},{"editability_required":true,"editable":true,"h":0.28,"id":"body_data","style_ref":"card_body","text":"用证据发现关键变化","type":"text","w":2.0,"x":6.1,"y":2.79,"z_index":9},{"editability_required":true,"editable":true,"h":0.28,"id":"body_quality","style_ref":"card_body","text":"在交付前发现结构问题","type":"text","w":2.0,"x":10.29,"y":2.79,"z_index":9},{"editability_required":true,"editable":true,"h":0.28,"id":"body_innovation","style_ref":"card_body","text":"用小步试验降低不确定性","type":"text","w":2.0,"x":1.92,"y":5.06,"z_index":9},{"editability_required":true,"editable":true,"h":0.28,"id":"body_collaboration","style_ref":"card_body","text":"让角色边界和交接清晰","type":"text","w":2.0,"x":6.1,"y":5.06,"z_index":9},{"editability_required":true,"editable":true,"h":0.28,"id":"body_improvement","style_ref":"card_body","text":"让每次复盘产生新行动","type":"text","w":2.0,"x":10.29,"y":5.06,"z_index":9},{"editable":true,"geometry":"straight","h":0,"id":"divider_goal","line":{"begin_arrow":"none","color":"#C6D9F4","end_arrow":"none","width_pt":1.2},"type":"line","w":1.96,"x":1.92,"y":3.15,"z_index":8},{"editable":true,"geometry":"straight","h":0,"id":"divider_data","line":{"begin_arrow":"none","color":"#C6D9F4","end_arrow":"none","width_pt":1.2},"type":"line","w":1.96,"x":6.1,"y":3.15,"z_index":8},{"editable":true,"geometry":"straight","h":0,"id":"divider_quality","line":{"begin_arrow":"none","color":"#C6D9F4","end_arrow":"none","width_pt":1.2},"type":"line","w":1.96,"x":10.29,"y":3.15,"z_index":8},{"editable":true,"geometry":"straight","h":0,"id":"divider_innovation","line":{"begin_arrow":"none","color":"#C6D9F4","end_arrow":"none","width_pt":1.2},"type":"line","w":1.96,"x":1.92,"y":5.42,"z_index":8},{"editable":true,"geometry":"straight","h":0,"id":"divider_collaboration","line":{"begin_arrow":"none","color":"#C6D9F4","end_arrow":"none","width_pt":1.2},"type":"line","w":1.96,"x":6.1,"y":5.42,"z_index":8},{"editable":true,"geometry":"straight","h":0,"id":"divider_improvement","line":{"begin_arrow":"none","color":"#C6D9F4","end_arrow":"none","width_pt":1.2},"type":"line","w":1.96,"x":10.29,"y":5.42,"z_index":8}],"metadata":{"iteration":2,"topic":"团队能力地图","typography_interaction":"match-source"},"request":"request.json","schema_version":"1.3","slide":{"background":"#F4F7FA","height_in":7.5,"width_in":13.333},"source":{"height_px":941,"image":"source.png","width_px":1672},"styles":{"card_body":{"align":"left","bold":false,"color":"#3E5C86","fit":"shrink","font_face":"Microsoft YaHei","font_size_pt":13,"language":"zh-CN","margin_in":0,"valign":"middle"},"card_title":{"align":"left","bold":true,"color":"#14366E","fit":"shrink","font_face":"Microsoft YaHei","font_size_pt":18,"language":"zh-CN","margin_in":0,"valign":"middle"},"subtitle":{"align":"left","bold":false,"color":"#426393","fit":"shrink","font_face":"Microsoft YaHei","font_size_pt":18,"language":"zh-CN","margin_in":0,"valign":"middle"},"title":{"align":"left","bold":true,"color":"#163B78","fit":"shrink","font_face":"Microsoft YaHei","font_size_pt":34,"language":"zh-CN","margin_in":0,"valign":"middle"}}}
