{"asset_manifest":"asset_manifest.json","elements":[{"color":"#111111","content_ref":"S01-title","editability_required":true,"editable":true,"font_face":"Microsoft YaHei","font_size_pt":28,"h":0.75,"id":"title-object","joiner":"","segment_order":0,"text":"Scoped revision","type":"text","w":11.9997,"x":0.66665,"y":0.3,"z_index":2},{"editable":true,"fill":{"color":"#DDEEFF"},"h":1.875,"id":"card-01","shape":"roundRect","type":"shape","w":3.33325,"x":1.19997,"y":2.625,"z_index":1},{"editable":true,"fill":{"color":"#DDEEFF"},"h":1.875,"id":"card-02","shape":"roundRect","type":"shape","w":3.33325,"x":6.39984,"y":2.625,"z_index":1},{"editable":true,"from_id":"card-01","h":0.075,"id":"connector-01","line":{"color":"#53647A","width_pt":1.5},"to_id":"card-02","type":"line","w":1.86662,"x":4.53322,"y":3.6,"z_index":0},{"alt_text":"hero","asset_id":"hero","contains_text":false,"editable":false,"fit":"contain","h":2.25,"id":"hero","preserve_aspect_ratio":true,"rounding":false,"text_editability_exempt":false,"type":"image","w":2.39994,"x":10.13308,"y":1.875,"z_index":1}],"metadata":{"iteration":2,"page_id":"S01","topic":"P2 Handoff","typography_interaction":"default"},"request":"request.json","schema_version":"1.4","slide":{"background":"#FFFFFF","height_in":7.5,"width_in":13.333},"source":{"height_px":900,"image":"source.png","width_px":1600},"styles":{}}
